{
  "$schema": "",
  "correctness_properties": [],
  "error_handling": [],
  "execution_paths": [],
  "glossary": {},
  "introduction": "Spec with all six EARS patterns.",
  "requirements": [
    {
      "acceptance_criteria": [
        {
          "action": "do X",
          "ears_pattern": "ubiquitous",
          "id": "99-REQ-1.1",
          "return_contract": null,
          "system": "the system"
        },
        {
          "action": "respond",
          "ears_pattern": "event_driven",
          "id": "99-REQ-1.2",
          "return_contract": null,
          "system": "the system",
          "trigger": "user clicks"
        },
        {
          "action": "a",
          "condition": "c",
          "ears_pattern": "complex_event",
          "id": "99-REQ-1.3",
          "return_contract": null,
          "system": "s",
          "trigger": "t"
        },
        {
          "action": "a",
          "ears_pattern": "state_driven",
          "id": "99-REQ-1.4",
          "return_contract": null,
          "state": "active",
          "system": "s"
        },
        {
          "action": "alert",
          "ears_pattern": "unwanted",
          "error_condition": "disk full",
          "id": "99-REQ-1.5",
          "return_contract": null,
          "system": "s"
        },
        {
          "action": "log",
          "ears_pattern": "optional",
          "feature": "debug mode",
          "id": "99-REQ-1.6",
          "return_contract": null,
          "system": "s"
        }
      ],
      "edge_cases": [],
      "id": "99-REQ-1",
      "title": "EARS Patterns",
      "user_story": {
        "benefit": "verify rendering",
        "goal": "test all EARS patterns",
        "role": "tester"
      }
    }
  ],
  "schema_version": 1,
  "spec_id": "99",
  "spec_name": "all_ears_patterns"
}
