{
  "$schema": "https://agent-fox.dev/schemas/requirements.v1.json",
  "spec_id": "02",
  "spec_name": "draft_feature",
  "schema_version": 1,
  "introduction": "A draft feature for testing.",
  "glossary": {
    "feature": "A capability of the system."
  },
  "requirements": [
    {
      "id": "02-REQ-1",
      "title": "Draft Requirement",
      "user_story": {
        "role": "developer",
        "goal": "test lifecycle transitions",
        "benefit": "confidence in lifecycle management"
      },
      "acceptance_criteria": [
        {
          "id": "02-REQ-1.1",
          "ears_pattern": "ubiquitous",
          "system": "the `feature`",
          "action": "support lifecycle transitions",
          "return_contract": null
        }
      ],
      "edge_cases": []
    }
  ],
  "correctness_properties": [
    {
      "id": "02-PROP-1",
      "title": "Lifecycle transition legality",
      "for_any": "status pair",
      "invariant": "transition succeeds iff pair is legal",
      "validates": [
        "02-REQ-1.1"
      ]
    }
  ],
  "execution_paths": [
    {
      "id": "02-PATH-1",
      "title": "Transition draft to active",
      "steps": [
        {
          "actor": "consumer",
          "action": "call transition(spec, active, dir)"
        },
        {
          "actor": "system",
          "action": "compute intent hash and update status"
        }
      ]
    }
  ],
  "error_handling": []
}
