{
  "$schema": "https://agent-fox.dev/schemas/requirements.v1.json",
  "correctness_properties": [
    {
      "for_any": "valid input",
      "id": "05-PROP-1",
      "invariant": "processing twice yields the same result",
      "title": "Processing is idempotent",
      "validates": [
        "05-REQ-1.1"
      ]
    }
  ],
  "error_handling": [
    {
      "behavior": "return error response",
      "condition": "null input received",
      "id": "05-ERR-1",
      "requirement_id": "05-REQ-1.E1"
    }
  ],
  "execution_paths": [
    {
      "id": "05-PATH-1",
      "steps": [
        {
          "action": "submit request",
          "actor": "operator"
        },
        {
          "action": "process and return result",
          "actor": "`ExampleSystem`"
        }
      ],
      "title": "Operator processes a request end-to-end"
    }
  ],
  "glossary": {
    "ExampleSystem": "The system under test in this golden fixture."
  },
  "introduction": "An example feature for testing the afspec library.",
  "requirements": [
    {
      "acceptance_criteria": [
        {
          "action": "process the request",
          "ears_pattern": "ubiquitous",
          "id": "05-REQ-1.1",
          "return_contract": "the processed result",
          "system": "`ExampleSystem`"
        }
      ],
      "edge_cases": [
        {
          "action": "return an error",
          "ears_pattern": "unwanted",
          "error_condition": "the input is null",
          "id": "05-REQ-1.E1",
          "return_contract": null,
          "system": "`ExampleSystem`"
        }
      ],
      "id": "05-REQ-1",
      "title": "Example requirement",
      "user_story": {
        "benefit": "get value",
        "goal": "do something useful",
        "role": "operator"
      }
    }
  ],
  "schema_version": 1,
  "spec_id": "05",
  "spec_name": "example_feature"
}
